CIK,Ticker,Name
,FSTA,Fidelity MSCI Consumer Staples Index ETF
,LFGY,YieldMax Crypto Industry & Tech Portfolio Option Income ETF
,QQA,Invesco QQQ Income Advantage ETF
,IETC,iShares U.S. Tech Independence Focused ETF
,IBTP,iShares iBonds Dec 2034 Term Treasury ETF
,IEZ,iShares U.S. Oil Equipment & Services ETF
,DIV,Global X SuperDividend U.S. ETF
,FFLC,Fidelity Covington Trust - Fidelity Fundamental Large Cap Core ETF
,QGRO,American Century U.S. Quality Growth ETF
,LTPZ,PIMCO 15+ Year U.S. TIPS Index Exchange-Traded Fund
,WEED,Roundhill Cannabis ETF
,GSG,iShares S&P GSCI Commodity-Indexed Trust
,PFFV,Global X Variable Rate Preferred ETF
,HCMT,Direxion HCM Tactical Enhanced U.S. Equity Strategy ETF
,FEOE,First Eagle Overseas Equity ETF
,EZA,iShares MSCI South Africa ETF
,PMAY,Innovator U.S. Equity Power Buffer ETF - May
,FLHY,Franklin High Yield Corporate ETF
,EETH,ProShares Ether ETF
,TBG,TBG Dividend Focus ETF
,VCRM,Vanguard Tax-Managed Funds Vang
,PCGG,Polen Capital Global Growth ETF
,FCOM,Fidelity MSCI Communication Services Index ETF
,UTSL,Direxion Daily Utilities Bull 3X Shares
,BBIN,JPMorgan BetaBuilders International Equity ETF
,XTEN,Bondbloxx Bloomberg Ten Year Target Duration US Treasury ETF
,CSRE,Cohen & Steers Real Estate Active ETF
,SLTY,Tidal Trust II
,RDTE,Roundhill Russell 2000 0DTE Covered Call Strategy ETF
,HYBX,TCW High Yield Bond ETF
,XONE,Bondbloxx Bloomberg One Year Target Duration US Treasury ETF
,AIPI,REX AI Equity Premium Income ETF
,IXG,iShares Global Financials ETF
,EUM,ProShares Short MSCI Emerging Markets
,SHYL,Xtrackers Short Duration High Yield Bond ETF
,DFNM,Dimensional National Municipal Bond ETF
,NFTY,First Trust India NIFTY 50 Equal Weight ETF
,BKLC,BNY Mellon US Large Cap Core Equity ETF
,SBAR,Simplify Barrier Income ETF
,SRVR,Pacer Benchmark Data & Infrastructure Real Estate SCTR ETF
,IQQQ,ProShares Nasdaq-100 High Income ETF
,SMLF,iShares U.S. Small-Cap Equity Factor ETF
,TGRT,T. Rowe Price Growth ETF
,XCEM,Columbia EM Core ex-China ETF
,MSLC,Morgan Stanley Pathway Large Cap Equity ETF
,JMSI,J P Morgan Exchange-Traded Fund Trust - Sustainable Municipal Income Etf Fund
,KORP,American Century Diversified Corporate Bond ETF
,FYC,First Trust Small Cap Growth AlphaDEX Fund
,MINO,PIMCO Municipal Income Opportunities Active Exchange-Traded Fund
,SEIE,SEI Select International Equity ETF
,ARCX,Tradr 2X Long ACHR Daily ETF
,XYZY,YieldMax XYZ Option Income Strategy ETF
,TXUE,Thornburg International Equity ETF
,VOOV,Vanguard S&P 500 Value Index Fund ETF Shares
,HYS,PIMCO 0-5 Year High Yield Corporate Bond Index Exchange-Traded Fund
,SLVR,Sprott Silver Miners & Physical Silver ETF
,MFSG,MFS Active Growth ETF
,FXO,First Trust Financials AlphaDEX Fund
,EWD,iShares MSCI Sweden ETF
,IEQ,Lazard Active ETF Trust - Lazard International Dynamic Equity ETF
,FWD,AB Disruptors ETF
,PBUS,Invesco MSCI USA ETF
,GVI,iShares Intermediate Government/Credit Bond ETF
,XCCC,BondBloxx CCC Rated USD High Yield Corporate Bond ETF
,DAUG,FT Vest U.S. Equity Deep Buffer ETF - August
,GARP,iShares Trust - iShares MSCI USA Quality GARP ETF
,YOLO,AdvisorShares Pure Cannabis ETF
,SCIO,First Trust Structured Credit Income Opportunities ETF
,JSMD,Janus Henderson Small/Mid Cap Growth Alpha ETF
,IWX,iShares Russell Top 200 Value ETF
,FDIS,Fidelity MSCI Consumer Discretionary Index ETF
,USTB,VictoryShares Short-Term Bond ETF
,TSMU,GraniteShares 2x Long TSM Daily ETF
,DIVB,iShares Core Dividend ETF
,SGVT,Schwab Government Money Market ETF
,FUMB,First Trust Ultra Short Duration Municipal ETF
,SCCR,Schwab Core Bond ETF
,HEWJ,iShares Currency Hedged MSCI Japan ETF
,ZALT,Innovator U.S. Equity 10 Buffer ETF - Quarterly
,WTPI,WisdomTree Trust - WisdomTree Equity Premium Income Fund
,HACK,Amplify Cybersecurity ETF
,JMOM,JPMorgan U.S. Momentum Factor ETF
,GXPT,Global X PureCap MSCI Information Technology ETF
,IBCA,iShares iBonds Dec 2035 Term Corporate ETF
,TFLR,T. Rowe Price Floating Rate ETF
,DTD,WisdomTree U.S. Total Dividend Fund
,DSI,iShares ESG MSCI KLD 400 ETF
,ZAP,Global X U.S. Electrification ETF
,TAIL,Cambria Tail Risk ETF
,QPUX,Defiance 2X Daily Long Pure Quantum ETF
,PSC,Principal U.S. Small-Cap ETF
,SCEC,Sterling Capital Enhanced Core Bond ETF
,SPYX,SPDR S&P 500 Fossil Fuel Reserves Free ETF
,HEGD,Swan Hedged Equity US Large Cap ETF
,SEIV,SEI Enhanced US Large Cap Value Factor ETF
,YLD,Principal Active High Yield ETF
,XPH,SPDR S&P Pharmaceuticals ETF
,IQDF,FlexShares International Quality Dividend Index Fund
,NOWL,GraniteShares 2x Long NOW Daily ETF
,FLSP,Franklin Systematic Style Premia ETF
,PJAN,Innovator U.S. Equity Power Buffer ETF - January
,RBLU,T-Rex 2X Long RBLX Daily Target ETF
,BUFF,Innovator Laddered Allocation Power Buffer ETF
,YCL,ProShares Ultra Yen
,AMDG,Themes ETF Trust - Leverage Shares 2X Long AMD Daily ETF
,ILCG,iShares Morningstar Growth ETF
,SLVP,iShares MSCI Global Silver and Metals Miners ETF
,FLRT,Pacer Pacific Asset Floating Rate High Income ETF
,DJP,iPath Bloomberg Commodity Index Total Return(SM) ETN
,IGRO,iShares International Dividend Growth ETF
,TNGY,Tortoise Energy Fund
,DFCA,Dimensional California Municipal Bond ETF
,IBTM,iShares iBonds Dec 2032 Term Treasury ETF
,SUSA,iShares ESG Optimized MSCI USA ETF
,EZBC,Franklin Bitcoin ETF
,BLOX,Nicholas Crypto Income ETF
,NVII,REX NVDA Growth & Income ETF
,ECNS,iShares MSCI China Small-Cap ETF
,GVAL,Cambria Global Value ETF
,IHE,iShares U.S. Pharmaceuticals ETF
,BTCL,T-Rex 2X Long Bitcoin Daily Target ETF
,BKIE,BNY Mellon International Equity ETF
,DSTL,Distillate U.S. Fundamental Stability & Value ETF
,XOMO,Yieldmax XOM Option Income Strategy ETF
,IMCG,iShares Morningstar Mid-Cap Growth ETF
,SGDM,Sprott Gold Miners ETF
,NTSX,WisdomTree U.S. Efficient Core Fund
,FNX,First Trust Mid Cap Core AlphaDEX Fund
,NFRA,FlexShares STOXX Global Broad Infrastructure Index Fund
,UOCT,Innovator U.S. Equity Ultra Buffer ETF October
,EQWL,Invesco S&P 100 Equal Weight ETF
,FLGV,Franklin U.S. Treasury Bond ETF
,QUBX,Tradr 2X Long QUBT Daily ETF
,BKDV,BNY Mellon Dynamic Value ETF
,ILOW,AB International Low Volatility Equity ETF
,BSJU,Invesco Bulletshares 2030 High Yield Corporate Bond ETF
,IWL,iShares Russell Top 200 ETF
,HMOP,Hartford Municipal Opportunities ETF
,DWSH,AdvisorShares Dorsey Wright Short ETF
,YQQQ,YieldMax Short N100 Option Income Strategy ETF
,GOOX,T-Rex 2X Long Alphabet Daily Target ETF
,QTJA,Innovator Growth Accelerated Plus ETF - January
,SNOV,FT Vest U.S. Small Cap Moderate Buffer ETF - November
,DCOR,Dimensional US Core Equity 1 ETF
,IBMO,iShares iBonds Dec 2026 Term Muni Bond ETF
,CRWL,GraniteShares 2x Long CRWD Daily ETF
,IBMN,iShares iBonds Dec 2025 Term Muni Bond ETF
,DFIP,Dimensional Inflation-Protected Securities ETF
,IYG,iShares U.S. Financial Services ETF
,FIDI,Fidelity International High Dividend ETF
,CVNY,YieldMax CVNA Option Income Strategy ETF
,CMBS,iShares CMBS ETF
,DFEV,Dimensional Emerging Markets Value ETF
,KHPI,Kensington Hedged Premium Income ETF
,JGLO,Jpmorgan Global Select Equity ETF
,APOC,Innovator Equity Defined Protection ETF - 6 Mo Apr/Oct
,ICOI,Bitwise COIN Option Income Strategy ETF
,CEFS,Saba Closed-End Funds ETF
,EMGF,iShares Emerging Markets Equity Factor ETF
,EVSB,Eaton Vance Ultra-Short Income ETF
,GBUG,Sprott Active Gold & Silver Miners ETF
,WTAI,WisdomTree Artificial Intelligence and Innovation Fund
,UBND,VictoryShares Core Plus Intermediate Bond ETF
,FNCL,Fidelity MSCI Financials Index ETF
,LVHD,Franklin U.S. Low Volatility High Dividend Index ETF
,NAUG,Innovator Growth-100 Power Buffer ETF - August
,HNDL,Strategy Shares Nasdaq 7 Handl Index ETF
,COMT,iShares GSCI Commodity Dynamic Roll Strategy ETF
,MAGY,Roundhill Magnificent Seven Covered Call ETF
,QDEC,FT Vest Nasdaq-100 Buffer ETF – December
,WINN,Harbor Long-Term Growers ETF
,BTCO,Invesco Galaxy Bitcoin ETF
,TDIV,First Trust NASDAQ Technology Dividend Index Fund
,IAUI,NEOS Gold High Income ETF
,XFIV,Bondbloxx Bloomberg Five Year Target Duration US Treasury ETF
,UTWO,F/m US Treasury 2 Year Note ETF
,PHO,Invesco Water Resources ETF
,TJUL,Innovator Equity Defined Protection ETF – 2 Yr to July 2027
,IGLD,FT Vest Gold Strategy Target Income ETF
,AOM,iShares Core 40/60 Moderate Allocation ETF
,SEIX,Virtus Seix Senior Loan ETF
,VTES,Vanguard Short-Term Tax-Exempt Bond ETF Shares
,USXF,iShares ESG Advanced MSCI USA ETF
,XSVM,Invesco S&P SmallCap Value with Momentum ETF
,AVSC,Avantis US Small Cap Equity ETF
,USOI,UBS ETRACS Crude Oil Shares Covered Call ETN
,ILDR,First Trust Innovation Leaders ETF
,SEIM,SEI Enhanced US Large Cap Momentum Factor ETF
,FGDL,Franklin Responsibly Sourced Gold ETF
,THD,iShares MSCI Thailand ETF
,DGCB,Dimensional Global Credit ETF
,PIPE,Invesco SteelPath MLP & Energy Infrastructure ETF
,WEBS,Direxion Daily Dow Jones Internet Bear 3X Shares
,RSPH,Invesco S&P 500 Equal Weight Health Care ETF
,FDEC,FT Vest U.S. Equity Buffer ETF - December
,CLOU,Global X Cloud Computing ETF Global X Cloud Computing ETF
,KORU,Direxion Daily South Korea Bull 3X Shares
,XMLV,Invesco S&P MidCap Low Volatility ETF
,UJAN,Innovator U.S. Equity Ultra Buffer ETF - January
,RISR,FolioBeyond Alternative Income and Interest Rate Hedge ETF
,OILD,MicroSectorsTM Oil & Gas Exploration & Production -3X Inverse Leveraged ETNs
,FLQL,Franklin U.S. Large Cap Multifactor Index ETF
,BBLU,Ea Bridgeway Blue Chip ETF
,CLOX,Eldridge AAA CLO ETF
,PTMC,Pacer Trendpilot US Mid Cap ETF
,FEP,First Trust Europe AlphaDEX Fund
,FLCH,Franklin FTSE China ETF
,BCD,abrdn Bloomberg All Commodity Longer Dated Strategy K-1 Free ETF
,SIXG,Defiance Connective Technologies ETF
,SMHX,VanEck Fabless Semiconductor ETF
,DIPS,YieldMax Short NVDA Option Income Strategy ETF
,MULL,GraniteShares 2x Long MU Daily ETF
,BBAG,JPMorgan BetaBuilders U.S. Aggregate Bond ETF
,AFLG,First Trust Active Factor Large Cap ETF
,GAPR,FT Vest U.S. Equity Moderate Buffer ETF - April
,APIE,ActivePassive International Equity ETF
,MGC,Vanguard Mega Cap Index Fund
,PTRB,PGIM Total Return Bond ETF
,EIPI,FT Energy Income Partners Enhanced Income ETF
,TMAT,Main Thematic Innovation ETF
,HIBL,Direxion Daily S&P 500 High Beta Bull 3X Shares
,BSMV,Invesco BulletShares 2031 Municipal Bond ETF
,ZAUG,Innovator Equity Defined Protection ETF - 1 Yr August
,ROBT,First Trust Nasdaq Artificial Intelligence and Robotics ETF
,IVOO,Vanguard S&P Mid-Cap 400 Index Fund ETF Shares
,INDY,iShares India 50 ETF
,LQDW,iShares Investment Grade Corporate Bond Buywrite Strategy ETF
,IJT,iShares S&P Small-Cap 600 Growth ETF
,VTC,Vanguard Total Corporate Bond ETF ETF Shares
,FDHY,Fidelity Enhanced High Yield ETF
,UNOV,Innovator U.S. Equity Ultra Buffer ETF - November
,FLCO,Franklin Investment Grade Corporate ETF
,HAWX,iShares Currency Hedged MSCI ACWI ex U.S. ETF
,QQEW,First Trust NASDAQ-100 Equal Weighted Index Fund
,QFLR,Innovator Nasdaq-100 Managed Floor ETF
,KFEB,Innovator U.S. Small Cap Power Buffer ETF - February
,AVS,Direxion Daily AVGO Bear 1X Shares
,LQTI,FT Vest Investment Grade & Target Income ETF
,BSMQ,Invesco BulletShares (R) 2026 Municipal Bond ETF
,RODM,Hartford Multifactor Developed Markets (ex-US) ETF
,EMHY,iShares J.P. Morgan EM High Yield Bond ETF
,CSPF,Cohen & Steers Preferred and Income Opportunities Active ETF
,JHMD,John Hancock Multifactor Developed International ETF
,RPV,Invesco S&P 500 Pure Value ETF
,RIET,Hoya Capital High Dividend Yield ETF
,DDWM,WisdomTree Dynamic International Equity ETF
,JIVE,Jpmorgan International Value ETF
,GJUN,FT Vest U.S. Equity Moderate Buffer ETF - June
,PXF,Invesco RAFI Developed Markets ex-U.S. ETF
,WNTR,YieldMax MSTR Short Option Income Strategy ETF
,TSMY,YieldMax TSM Option Income Strategy ETF
,BSMW,Invesco Bulletshares 2032 Municipal Bond ETF
,TYA,Simplify Intermediate Term Treasury Futures Strategy ETF
,CGIB,Capital Group International Bond ETF (USD-Hedged)
,JMEE,JPMorgan Small & Mid Cap Enhanced Equity ETF
,BINT,Bluemonte Global Equity ETF
,LQDH,iShares Interest Rate Hedged Corporate Bond ETF
,BUZZ,VanEck Social Sentiment ETF
,MMIN,NYLI MacKay Muni Insured ETF
,EDGI,3EDGE Dynamic International Equity ETF
,PYPG,Leverage Shares 2X Long PYPL Daily ETF
,IYC,iShares US Consumer Discretionary ETF
,BSMR,Invesco BulletShares (R) 2027 Municipal Bond ETF
,IPAC,iShares Core MSCI Pacific ETF
,HIPS,GraniteShares HIPS US High Income ETF
,KBA,KraneShares Bosera MSCI China A 50 Connect Index ETF
,PBDC,Putnam BDC Income ETF
,SDCI,USCF SummerHaven Dynamic Commodity Strategy No K-1 Fund
,HEQT,Simplify Hedged Equity ETF
,ENFR,Alerian Energy Infrastructure ETF
,APCB,ActivePassive Core Bond ETF
,CSMD,Congress SMID Growth ETF
,HYTI,FT Vest High Yield & Target Income ETF
,PHB,Invesco Fundamental High Yield Corporate Bond ETF
,DIG,ProShares Ultra Energy
,COLO,Global X MSCI Colombia ETF
,IG,Principal Investment Grade Corporate Active ETF
,TDVG,T. Rowe Price Dividend Growth ETF
,GIAX,Nicholas Global Equity and Income ETF
,DMBS,Doubleline Etf Trust - Mortgage ETF
,IPO,Renaissance IPO ETF
,OUSM,ALPS O'Shares U.S. Small-Cap Quality Dividend ETF Shares
,FDV,Federated Hermes U.S. Strategic Dividend ETF
,BSCY,Invesco BulletShares 2034 Corporate Bond ETF
,STPZ,PIMCO 1-5 Year U.S. TIPS Index Exchange-Traded Fund
,EVLN,Eaton Vance Floating-Rate ETF
,AUGW,AllianzIM U.S. Large Cap Buffer20 Aug ETF
,BUFG,FT Vest Buffered Allocation Growth ETF
,TAGG,T. Rowe Price QM U.S. Bond ETF
,DJUN,FT Vest U.S. Equity Deep Buffer ETF - June
,FXP,ProShares UltraShort FTSE China 50
,MDYG,SPDR S&P 400 Mid Cap Growth ETF
,PYPY,Yieldmax PYPL Option Income Strategy ETF
,UMAR,Innovator U.S. Equity Ultra Buffer ETF - March
,EDGF,3EDGE Dynamic Fixed Income ETF
,SPGM,SPDR Portfolio MSCI Global Stock Market ETF
,DECU,AllianzIM U.S. Equity Buffer15 Uncapped Dec ETF
,AVRE,Avantis Real Estate ETF
,DDLS,WisdomTree Dynamic International SmallCap Equity ETF
,DAX,Global X DAX Germany ETF
,KOMP,SPDR S&P Kensho New Economies Composite ETF
,IQDG,WisdomTree International Quality Dividend Growth Fund
,NFXS,Direxion Daily NFLX Bear 1X Shares
,TPIF,Timothy Plan International ETF
,BKCH,Global X Blockchain ETF
,GENT,Genter Capital Taxable Quality Intermediate ETF
,IBND,SPDR Bloomberg International Corporate Bond ETF
,HAUZ,Xtrackers International Real Estate ETF
,VSLU,Applied Finance Valuation Large Cap US ETF
,MMCA,NYLI MacKay California Muni Intermediate ETF
,HDGE,AdvisorShares Ranger Equity Bear ETF
,BDBT,Bluemonte Core Bond ETF
,SNOY,YieldMax SNOW Option Income Strategy ETF
,FIVA,Fidelity International Value Factor ETF
,DGS,WisdomTree Emerging Markets SmallCap Dividend Fund
,SPRX,Spear Alpha ETF
,AUSM,Allspring Ultra Short Municipal ETF
,FNDB,Schwab Fundamental U.S. Broad Market ETF
,MDIV,Multi-Asset Diversified Income Index Fund
,DIAL,Columbia Diversified Fixed Income Allocation ETF
,FICS,First Trust International Developed Cap Strength ETF
,PFEB,Innovator U.S. Equity Power Buffer ETF - February
,MPRO,Monarch ProCap ETF
,POCT,Innovator U.S. Equity Power Buffer ETF October
,WTIU,MicroSectors Energy 3X Leveraged ETN
,BSMU,Invesco BulletShares 2030 Municipal Bond ETF
,NODE,VanEck Onchain Economy ETF
,FMAR,FT Vest U.S. Equity Buffer ETF - March
,TARK,Tradr 2X Long Innovation ETF
,SHYD,VanEck Short High Yield Muni ETF
,ROM,ProShares Ultra Technology
,FISR,SPDR SSGA Fixed Income Sector Rotation ETF
,FTXO,First Trust Nasdaq Bank ETF
,SRET,Global X SuperDividend REIT ETF
,SMIZ,Zacks Small/Mid Cap ETF
,CPSL,Calamos Laddered S&P 500 Structured Alt Protection ETF
,QTOP,iShares Nasdaq Top 30 Stocks ETF
,OSCV,Opus Small Cap Value Plus ETF
,DHS,WisdomTree U.S. High Dividend Fund
,IEO,iShares U.S. Oil & Gas Exploration & Production ETF
,ZECP,Zacks Earnings Consistent Portfolio ETF
,CMDT,PIMCO Commodity Strategy Active Exchange-Traded Fund
,TSMZ,Direxion Daily TSM Bear 1X Shares
,DWAS,Invesco DWA SmallCap Momentum ETF
,BUFC,AB Conservative Buffer ETF
,IJUN,Innovator International Developed Power Buffer ETF - June
,KGLD,Kurv Gold Enhanced Income ETF
,CSCL,Direxion Daily CSCO Bull 2X Shares
,MODL,Victoryshares Westend U.S. Sector ETF
,FIGB,Fidelity Investment Grade Bond ETF
,QQQJ,Invesco NASDAQ Next Gen 100 ETF
,SAMT,Strategas Macro Thematic Opportunities ETF
,FDEM,Fidelity Emerging Markets Multifactor ETF
,OCTH,Innovator Premium Income 20 Barrier ETF - October
,PAPI,Parametric Equity Premium Income ETF
,JHCB,John Hancock Corporate Bond ETF
,BMAY,Innovator U.S. Equity Buffer ETF- May
,XHS,SPDR S&P Health Care Services ETF
,THTA,SoFi Enhanced Yield ETF
,GMAY,FT Vest U.S. Equity Moderate Buffer ETF - May
,DOL,WisdomTree International LargeCap Dividend Fund
,RAVI,FlexShares Ultra-Short Income Fund
,EQL,ALPS Equal Sector Weight ETF
,IBTO,Ishares Ibonds Dec 2033 Term Treasury ETF
,RSST,Return Stacked U.S. Stocks & Managed Futures ETF
,JXI,iShares Global Utilities ETF
,GLTR,abrdn Physical Precious Metals Basket Shares ETF
,JHML,John Hancock Multifactor Large Cap ETF
,BLUX,Bluemonte Dynamic Total Market ETF
,BBHY,JPMorgan BetaBuilders USD High Yield Corporate Bond ETF
,RSSB,Return Stacked Global Stocks & Bonds ETF
,GREK,Global X MSCI Greece ETF
,COIG,Themes ETF Trust - Leverage Shares 2X Long COIN Daily ETF
,QBUF,Innovator Nasdaq-100 10 Buffer ETF - Quarterly
,VSTL,Tidal Trust II - Defiance Daily Target 2X Long VST ETF
,RSPG,Invesco S&P 500 Equal Weight Energy ETF
,USSE,Segall Bryant & Hamill Select Equity ETF
,MFSV,MFS Active Value ETF
,KOID,KraneShares Global Humanoid and Embodied Intelligence Index ETF
,DFEB,FT Vest U.S. Equity Deep Buffer ETF - February
,IVVB,iShares Large Cap Deep Buffer ETF
,NFLU,T-REX 2X Long NFLX Daily Target ETF
,DFAW,Dimensional World Equity ETF
,BCCC,Global X Bitcoin Covered Call ETF
,FID,First Trust S&P International Dividend Aristocrats ETF
,CERY,SPDR Bloomberg Enhanced Roll Yield Commodity Strategy No K-1 ETF
,ROUS,Hartford Multifactor US Equity ETF
,RSPR,Invesco S&P 500 Equal Weight Real Estate ETF
,RVNU,Xtrackers Municipal Infrastructure Revenue Bond ETF
,FMAG,Fidelity Magellan ETF
,PBP,Invesco S&P 500 BuyWrite ETF
,BSMS,Invesco BulletShares (R) 2028 Municipal Bond ETF
,HYZD,WisdomTree Interest Rate Hedged High Yield Bond Fund
,VSDM,Vanguard Tax-Managed Funds Vang
,STRV,Strive 500 ETF
,CORP,PIMCO Investment Grade Corporate Bond Index Exchange-Traded Fund
,GLOV,Goldman Sachs ActiveBeta(R) World Low Vol Plus Equity ETF
,RSPS,Invesco S&P 500 Equal Weight Consumer Staples ETF
,XLSR,SPDR SSGA US Sector Rotation ETF
,TDVI,FT Vest Technology Dividend Target Income ETF
,PWB,Invesco Dynamic Large Cap Growth ETF
,STCE,Schwab Crypto Thematic ETF
,NUBD,Nuveen ESG U.S. Aggregate Bond ETF
,SEIS,SEI Select Small Cap ETF
,PFFR,InfraCap REIT Preferred ETF
,GLXU,ETF Opportunities Trust T-REX 2
,CTBB,Qwest Corp. NT
,MGOV,First Trust Intermediate Government Opportunities ETF
,JUCY,Aptus Enhanced Yield ETF
,HLAL,Wahed FTSE USA Shariah ETF
,IDHQ,Invesco S&P International Developed Quality ETF
,EQAL,Invesco Russell 1000 Equal Weight ETF
,EQTY,Kovitz Core Equity ETF
,KARS,KraneShares Electric Vehicles and Future Mobility Index ETF
,PUSH,PGIM Ultra Short Municipal Bond ETF
,GSUS,Goldman Sachs MarketBeta US Equity ETF
,FEMB,First Trust Emerging Markets Local Currency Bond ETF
,IBD,Inspire Corporate Bond ETF
,GDEC,FT Vest U.S. Equity Moderate Buffer ETF - December
,XES,SPDR S&P Oil & Gas Equipment & Services ETF
,WEEK,Roundhill ETF Trust Roundhill W
,DDFL,Innovator Equity Dual Directional 15 Buffer ETF - July
,RSPU,Invesco S&P 500 Equal Weight Utilities ETF
,FLMB,Franklin Municipal Green Bond ETF
,PLOO,Leverage Shares 2x Capped Accelerated PLTR Monthly ETF
,MAXI,Simplify Bitcoin Strategy PLUS Income ETF
,PGHY,Invesco Global ex-US High Yield Corporate Bond ETF
,PNQI,Invesco NASDAQ Internet ETF
,ILTB,iShares Core 10+ Year USD Bond ETF
,CAPE,DoubleLine Shiller CAPE U.S. Equities ETF
,UBOT,"Direxion Daily Robotics, Artificial Intelligence & Automation Index Bull 2X Shares"
,DNOV,FT Vest U.S. Equity Deep Buffer ETF - November
,AIS,VistaShares Artificial Intelligence Supercycle ETF
,OSEA,Harbor International Compounders ETF
,ROBO,Robo Global Robotics and Automation Index ETF
,ROSC,Hartford Multifactor Small Cap ETF
,CCRV,iShares Commodity Curve Carry Strategy ETF
,YSPY,GraniteShares YieldBOOST SPY ETF
,SEEM,SEI Select Emerging Markets Equity ETF
,CAML,Congress Large Cap Growth ETF
,PIEQ,Principal International Equity ETF
,AEMS,Anfield Enhanced Market ETF
,ELON,Battleshares TSLA vs F ETF
,BSMP,Invesco BulletShares (R) 2025 Municipal Bond ETF
,MAMB,Monarch Ambassador Income ETF
,DRIV,Global X Autonomous & Electric Vehicles ETF
,AESR,Anfield U.S. Equity Sector Rotation ETF
,UMI,USCF Midstream Energy Income Fund
,CANE,Teucrium Sugar Fund
,BRHY,iShares High Yield Active ETF
,BFRZ,Innovator Equity Managed 100 Buffer ETF
,QCLN,First Trust NASDAQ Clean Edge Green Energy Index Fund
,BUFY,FT Vest Laddered International Moderate Buffer ETF
,JHPI,John Hancock Preferred Income ETF
,AVSF,Avantis Short-Term Fixed Income ETF
,XIJN,FT Vest U.S. Equity Buffer & Premium Income ETF - June
,FCTE,SMI 3Fourteen Full-Cycle Trend ETF
,THIR,THOR Index Rotation ETF
,VCEB,Vanguard ESG U.S. Corporate Bond ETF
,PWV,Invesco Dynamic Large Cap Value ETF
,AVLC,American Century ETF Trust Avan
,SMOT,VanEck Morningstar SMID Moat ETF
,FJUL,FT Vest U.S. Equity Buffer ETF - July
,GSOL,Grayscale Solana Trust (GSOL)
,VBND,Vident U.S. Bond Strategy ETF
,FFLG,Fidelity Covington Trust - Fidelity Fundamental Large Cap Growth ETF
,DBEU,Xtrackers MSCI Europe Hedged Equity ETF
,AVIV,Avantis International Large Cap Value ETF
,TAXF,American Century Diversified Municipal Bond ETF
,AMZA,InfraCap MLP ETF
,GOCT,FT Vest U.S. Equity Moderate Buffer ETF - October
,PSQA,Palmer Square CLO Senior Debt ETF
,PTNQ,Pacer Trendpilot 100 ETF
,SPRE,SP Funds S&P Global REIT Sharia ETF
,EIS,iShares MSCI Israel ETF
,LONZ,PIMCO Senior Loan Active Exchange-Traded Fund
,HYGH,iShares Interest Rate Hedged High Yield Bond ETF
,BLST,Bluemonte Short Term Bond ETF
,USVM,VictoryShares US Small Mid Cap Value Momentum ETF
,DECW,Allianzim U.S. Large Cap Buffer20 Dec ETF
,HGRO,Hedgeye Quality Growth ETF
,FEM,First Trust Emerging Markets AlphaDEX Fund
,BWZ,SPDR Bloomberg Short Term International Treasury Bond ETF
,KXI,iShares Global Consumer Staples ETF
,XRMI,Global X S&P 500 Risk Managed Income ETF
,RWO,SPDR Dow Jones Global Real Estate ETF
,MRSK,Toews Agility Shares Managed Risk ETF
,CRPT,First Trust SkyBridge Crypto Industry and Digital Economy ETF
,ESN,Essential 40 Stock ETF
,FXF,Invesco CurrencyShares Swiss Franc Trust
,EFAA,Invesco MSCI EAFE Income Advantage ETF
,HYIN,WisdomTree Private Credit & Alternative Income Fund
,XSD,SPDR S&P Semiconductor ETF
,IYY,iShares Dow Jones U.S. ETF
,FFOG,Franklin Focused Growth ETF
,DEFR,ETF Series Solutions Aptus Defe
,QUSA,VistaShares Target 15 USA Quality Income ETF
,EDGH,3EDGE Dynamic Hard Assets ETF
,VCR,Vanguard Consumer Discretionary Index Fund ETF Shares
,PSI,Invesco Semiconductors ETF
,GDMN,WisdomTree Efficient Gold Plus Gold Miners Strategy Fund
,SIXJ,AllianzIM U.S. Large Cap 6 Month Buffer10 Jan/Jul ETF
,HYTR,CounterPoint High Yield Trend ETF
,KMLM,KraneShares Mount Lucas Managed Futures Index Strategy ETF
,ISVL,iShares International Developed Small Cap Value Factor ETF
,TACK,Fairlead Tactical Sector Fund
,DNL,WisdomTree Global ex-U.S. Quality Dividend Growth Fund
,BVAL,Bluemonte Large Cap Value ETF
,RMOP,Rockefeller Opportunistic Municipal Bond ETF
,KRBN,KraneShares Global Carbon ETF
,REGL,ProShares S&P MidCap 400 Dividend Aristocrats ETF
,IMST,Bitwise MSTR Option Income Strategy ETF
,BSSX,Invesco Bulletshares 2033 Municipal Bond ETF
,SEIQ,SEI Enhanced US Large Cap Quality Factor ETF
,HEDJ,WisdomTree Europe Hedged Equity Fund
,VIDI,Vident International Equity Strategy ETF
,SYLD,Cambria Shareholder Yield ETF
,GDE,WisdomTree Efficient Gold Plus Equity Strategy Fund
,CGV,Conductor Global Equity Value ETF
,QETH,Invesco Galaxy Ethereum ETF
,JVAL,JPMorgan U.S. Value Factor ETF
,OBIL,F/m US Treasury 12 Month Bill ETF
,XSHQ,Invesco S&P SmallCap Quality ETF
,FDT,First Trust Developed Markets Ex-US AlphaDEX Fund
,BOEU,Direxion Daily BA Bull 2X Shares
,IBIE,iShares iBonds Oct 2028 Term TIPS ETF
,UTEN,F/m US Treasury 10 Year Note ETF
,BABO,YieldMax BABA Option Income Strategy ETF
,AIPO,Tidal Trust II - Defiance AI & Power Infrastructure ETF
,SETM,Sprott Critical Materials ETF
,VIOV,Vanguard S&P Small-Cap 600 Value Index Fund ETF Shares
,CEFZ,RiverNorth Active Income ETF
,TVAL,T. Rowe Price Value ETF
,XSHD,Invesco S&P SmallCap High Dividend Low Volatility ETF
,DBB,Invesco DB Base Metals Fund
,BKGI,Bny Mellon Global Infrastructure Income ETF
,FJAN,FT Vest U.S. Equity Buffer ETF - January
,JULP,PGIM S&P 500 Buffer 12 ETF - Jul
,DRLL,Strive U.S. Energy ETF
,CLSE,Convergence Long/Short Equity ETF
,JAJL,Innovator Equity Defined Protection ETF - 6 Mo Jan/Jul
,RPAR,RPAR Risk Parity ETF
,ZSILF,ZKB Silver ETF
,SMHB,ETRACS 2xMonthly Pay Leveraged US Small Cap High Dividend ETN
,TSME,Thrivent Small-Mid Cap Equity ETF
,HERO,Global X Video Games & Esports ETF
,ALTL,Pacer Lunt Large Cap Alternator ETF
,GRPM,Invesco S&P MidCap 400 GARP ETF
,BTGD,STKd 100% Bitcoin & 100% Gold ETF
,OVB,Overlay Shares Core Bond ETF
,UBT,ProShares Ultra 20+ Year Treasury
,JCPI,JPMorgan Inflation Managed Bond ETF
,YCS,ProShares UltraShort Yen
,TPHD,Timothy Plan High Dividend Stock ETF
,BGIG,Bahl & Gaynor Income Growth ETF
,AVES,Avantis Emerging Markets Value ETF
,DFSE,Dimensional Emerging Markets Sustainability Core 1 ETF
,MAGX,Roundhill Daily 2X Long Magnificent Seven ETF
,PICB,Invesco International Corporate Bond ETF
,FFSM,Fidelity Covington Trust - Fidelity Fundamental Small-Mid Cap ETF
,EJUL,Innovator Emerging Markets Power Buffer ETF - July
,EEMA,iShares MSCI Emerging Markets Asia ETF
,FCAL,First Trust California Municipal High Income ETF
,IBTQ,iShares iBonds Dec 2035 Term Treasury ETF
,PTBD,Pacer Trendpilot US Bond ETF
,WIP,SPDR FTSE International Government Inflation-Protected Bond ETF
,ORR,Militia Long/Short Equity ETF
,KCCA,KraneShares California Carbon Allowance ETF
,FLTB,Fidelity Limited Term Bond ETF
,EPHE,iShares MSCI Philippines ETF
