CIK,Ticker,Name
,DUSA,Davis Select U.S. Equity ETF
,VPC,Virtus Private Credit ETF
,BLUC,Bluemonte Large Cap Core ETF
,IHAK,iShares Cybersecurity and Tech ETF
,BIBL,Inspire 100 ETF
,SSUS,Day Hagan Smart Sector ETF
,HECA,Hedgeye Capital Allocation ETF
,UNL,"United States 12 Month Natural Gas Fund, LP"
,HYBB,iShares BB Rated Corporate Bond ETF
,EUO,ProShares UltraShort Euro
,GMOI,GMO International Value ETF
,TMB,Thornburg Multi Sector Bond ETF
,BRTR,iShares Total Return Active ETF
,FDEV,Fidelity International Multifactor ETF
,EYLD,Cambria Emerging Shareholder Yield ETF
,XPAY,Roundhill ETF Trust - Roundhill S&P 500 Target 20 Managed Distribution ETF
,GPTY,YieldMax AI & Tech Portfolio Option Income ETF
,JHMU,John Hancock Dynamic Municipal Bond ETF
,EUSB,iShares ESG Advanced Total USD Bond Market ETF
,DLS,WisdomTree International SmallCap Dividend Fund
,FIDU,Fidelity MSCI Industrials Index ETF
,AOTG,AOT Growth and Innovation ETF
,SNSR,Global X Internet of Things ETF
,EQIN,Columbia U.S. Equity Income ETF
,FIAX,Nicholas Fixed Income Alternative ETF
,SEPZ,TrueShares Structured Outcome (September) ETF
,CGUI,Capital Group Ultra Short Income ETF
,SIHY,Harbor Scientific Alpha High-Yield ETF
,SFY,SoFi Select 500 ETF
,EURL,Direxion Daily FTSE Europe Bull 3X Shares
,BTCC,Grayscale Funds Trust Grayscale
,BTCW,WisdomTree Bitcoin Fund
,BYLD,iShares Yield Optimized Bond ETF
,KGRN,KraneShares MSCI China Clean Technology ETF
,PJIO,PGIM Jennison International Opportunities ETF
,KQQQ,Kurv Technology Titans Select ETF
,ITWO,ProShares Russell 2000 High Income ETF
,VOLT,Tema Electrification ETF
,SMB,VanEck Short Muni ETF
,FTA,First Trust Large Cap Value AlphaDEX Fund
,CNBS,Amplify Seymour Cannabis ETF
,LDUR,PIMCO Enhanced Low Duration Active Exchange-Traded Fund
,PSFM,Pacer Swan SOS Flex (April) ETF
,WCBR,WisdomTree Cybersecurity Fund
,AAA,Alternative Access First Priority CLO Bond ETF
,HEZU,iShares Currency Hedged MSCI Eurozone ETF
,URAA,Direxion Daily Uranium Bull 2X ETF
,SDSI,American Century Short Duration Strategic Income ETF
,SCC,ProShares UltraShort Consumer Discretionary
,BAMV,Brookstone Value Stock ETF
,GXPD,Global X Purecap MSCI Consumer Discretionary ETF
,IDUB,Aptus International Enhanced Yield ETF
,QQXL,ProShares Ultra QQQ TOP 30
,SPFF,Global X SuperIncome Preferred ETF
,COII,REX COIN Growth & Income ETF
,QQQH,NEOS Nasdaq-100 Hedged Equity Income ETF
,FNOV,FT Vest U.S. Equity Buffer ETF - November
,ABEQ,Absolute Select Value ETF
,PALC,Pacer Lunt Large Cap Multi-Factor Alternator ETF
,IBHG,iShares iBonds 2027 Term High Yield and Income ETF
,PZT,Invesco New York AMT-Free Municipal Bond ETF
,PIZ,Invesco Dorsey Wright Developed Markets Momentum ETF
,MBSF,Regan Floating Rate MBS ETF
,PRCS,Parnassus Core Select ETF
,PJUL,Innovator U.S. Equity Power Buffer ETF - July
,FXR,First Trust Industrials/Producer Durables AlphaDEX Fund
,QQH,HCM Defender 100 Index ETF
,RW,Rainwater Equity ETF
,XTJL,Innovator U.S. Equity Accelerated Plus ETF - July
,IYJ,iShares U.S. Industrials ETF
,SQEW,LeaderShares Equity Skew ETF
,QYLG,Global X Nasdaq 100 Covered Call & Growth ETF
,FCOR,Fidelity Corporate Bond ETF
,BCHP,Principal Focused Blue Chip ETF
,FYLD,Cambria Foreign Shareholder Yield ETF
,MSII,REX MSTR Growth & Income ETF
,XAIX,Xtrackers Artificial Intelligence and Big Data ETF
,TAXX,Bondbloxx IR+M Tax-Aware Short Duration ETF
,DJIA,Global X Dow 30 Covered Call ETF
,FDLS,Inspire Fidelis Multi Factor ETF
,LGH,HCM Defender 500 Index ETF
,IGBH,iShares Interest Rate Hedged Long-Term Corporate Bond ETF
,GSEU,Goldman Sachs ActiveBeta Europe Equity ETF
,AFK,VanEck Africa Index ETF
,GXPC,Global X Purecap MSCI Communication Services ETF
,AUGM,FT Vest U.S. Equity Max Buffer ETF - August
,MOO,VanEck Agribusiness ETF
,CPSA,Calamos S&P 500 Structured Alt Protection ETF - August
,BTF,CoinShares Bitcoin and Ether ETF
,FDRR,Fidelity Dividend ETF for Rising Rates
,CDC,VictoryShares US EQ Income Enhanced Volatility Wtd ETF
,GQRE,FlexShares Global Quality Real Estate Index Fund
,QLTI,GMO International Quality ETF
,QDF,FlexShares Quality Dividend Index Fund
,RUNN,Running Oak Efficient Growth ETF
,APMU,ActivePassive Intermediate Municipal Bond ETF
,DCRE,Doubleline Commercial Real Estate ETF
,MSFX,T-Rex 2X Long Microsoft Daily Target ETF
,XSW,SPDR S&P Software & Services ETF
,FFND,One Global ETF
,CVLC,Calvert US Large-Cap Core Responsible Index ETF
,QQUP,ProShares Ultra Top QQQ
,ABNY,Tidal Trust II YieldMax ABNB Op
,PAPR,Innovator U.S. Equity Power Buffer ETF - April
,DUBS,Aptus Large Cap Enhanced Yield ETF
,PGJ,Invesco Golden Dragon China ETF
,GMAR,FT Vest U.S. Equity Moderate Buffer ETF - March
,BAMU,Brookstone Ultra-Short Bond ETF
,GSEW,Goldman Sachs Equal Weight U.S. Large Cap Equity ETF
,AGZ,iShares Agency Bond ETF
,TPOR,Direxion Daily Transportation Bull 3X Shares
,UFO,Procure Space ETF
,SFTY,Horizon Managed Risk ETF
,BINV,Brandes International ETF
,GDLC,Grayscale Digital Large Cap Fund
,PSFF,Pacer Swan SOS Fund of Funds ETF
,ISCG,iShares Morningstar Small-Cap Growth ETF
,LSAF,LeaderSharesTM AlphaFactor US Core Equity ETF
,HRTS,Tema Heart & Health ETF
,EALT,Innovator U.S. Equity 5 To 15 Buffer ETF - Quarterly
,GFLW,VictoryShares Free Cash Flow Growth ETF
,DEHP,Dimensional Emerging Markets High Profitability ETF
,PRIV,SPDR SSGA IG Public & Private Credit ETF
,BAMD,Brookstone Dividend Stock ETF
,EWO,iShares MSCI Austria ETF
,PMAR,Innovator U.S. Equity Power Buffer ETF - March
,BRKW,Roundhill BRKB WeeklyPay ETF
,LMTL,Direxion Daily LMT Bull 2X ETF
,EMHC,SPDR Bloomberg Emerging Markets USD Bond ETF
,FIW,First Trust Water ETF
,OASC,OneAscent Small Cap Core ETF
,SBND,Columbia Short Duration Bond ETF
,QJUN,FT Vest Nasdaq-100 Buffer ETF - June
,EELV,Invesco S&P Emerging Markets Low Volatility ETF
,FLEU,Franklin FTSE Eurozone ETF
,AVGW,Roundhill AVGO WeeklyPay ETF
,FRI,First Trust S&P REIT Index Fund
,BASG,Brown Advisory Sustainable Growth ETF
,CHPY,YieldMax Semiconductor Portfolio Option Income ETF
,BSJV,Invesco BulletShares 2031 High Yield Corporate Bond ETF
,FFIU,Fieldstone UVA Unconstrained Medium-Term Fixed Income ETF
,MUD,Direxion Daily MU Bear 1X Shares
,CSB,VictoryShares US Small Cap High Div Volatility Wtd ETF
,VNAM,Global X MSCI Vietnam ETF
,QQQT,Defiance Nasdaq 100 Income Target ETF
,BNDC,FlexShares Core Select Bond Fund
,NULG,Nuveen ESG Large-Cap Growth ETF
,LTCN,Grayscale Litecoin Trust (LTC)
,PSP,Invesco Global Listed Private Equity ETF
,JANW,AllianzIM U.S. Large Cap Buffer20 Jan ETF
,DUG,ProShares UltraShort Energy ETF
,QCML,GraniteShares 2x Long QCOM Daily ETF
,FTBI,First Trust Exchange Traded Fund Vi - Balanced Income ETF
,REZ,iShares Residential and Multisector Real Estate ETF
,CATH,Global X S&P 500 Catholic Values ETF
,PFFL,ETRACS 2xMonthly Pay Leveraged Preferred Stock Index ETN
,TPLC,Timothy Plan US Large/Mid Cap Core ETF
,CLOB,VanEck AA-BB CLO ETF
,KDEF,PLUS Korea Defense Industry Index ETF
,IWLG,NYLI Winslow Large Cap Growth ETF
,EUSA,iShares MSCI USA Equal Weighted ETF
,MFUL,Mindful Conservative ETF
,QBER,Elevation Series Trust TrueShar
,AVMC,Avantis U.S. Mid Cap Equity ETF
,RAAA,Reckoner Leveraged AAA CLO ETF
,NFLT,Virtus Newfleet Multi-Sector Bond ETF
,BSMY,Invesco Bulletshares 2034 Municipal Bond ETF
,ADFI,Anfield Dynamic Fixed Income ETF
,KTEC,KraneShares Hang Seng TECH Index ETF
,FXG,First Trust Consumer Staples AlphaDEX Fund
,PINK,Simplify Health Care ETF
,GWX,SPDR S&P International Small Cap ETF
,SKOR,FlexShares Credit-Scored US Corporate Bond Index Fund
,BBBS,Bondbloxx BBB Rated 1-5 Year Corporate Bond ETF
,EUSM,Eventide US Market ETF
,BUSA,Brandes U.S. Value ETF
,IYLD,iShares Morningstar Multi-Asset Income ETF
,RSPN,Invesco S&P 500 Equal Weight Industrials ETF
,RSHO,Tema American Reshoring ETF
,GSC,Goldman Sachs Small Cap Equity ETF
,LCTU,BlackRock U.S. Carbon Transition Readiness ETF
,MUNY,Vanguard New York Tax-Exempt Bond ETF Shares
,ONOF,Global X Adaptive U.S. Risk Management ETF
,JETD,MAX Airlines -3X Inverse Leveraged ETN
,BLGR,Bluemonte Large Cap Growth ETF
,FVAL,Fidelity Value Factor ETF
,SLVO,UBS ETRACS Silver Shares Covered Call ETN
,DLLL,GraniteShares 2x Long DELL Daily ETF
,BATT,Amplify Lithium & Battery Technology ETF
,AVGG,Leverage Shares 2X Long AVGO Daily ETF
,QAI,NYLI Hedge Multi-Strategy Tracker ETF
,LSAT,LeaderShares AlphaFactor Tactical Focused ETF
,KCE,SPDR S&P Capital Markets ETF
,VRTL,GraniteShares 2x Long VRT Daily ETF
,DWX,SPDR S&P International Dividend ETF
,TQQY,GraniteShares YieldBOOST QQQ ETF
,CGW,Invesco S&P Global Water Index ETF
,DMXF,iShares ESG Advanced MSCI EAFE Index ETF
,NDEC,Innovator Growth-100 Power Buffer ETF - December
,FAN,First Trust Global Wind Energy ETF
,AVDS,Avantis International Small Cap Equity ETF
,EWN,iShares MSCI Netherlands ETF
,FJUN,FT Vest U.S. Equity Buffer ETF - June
,FQAL,Fidelity Quality Factor ETF
,GOLY,Strategy Shares - Strategy Shares Gold Enhanced Yield ETF
,GAL,SPDR SSgA Global Allocation ETF
,MEXX,Direxion Daily MSCI Mexico Bull 3X Shares
,EMBD,Global X Emerging Markets Bond ETF
,XYZG,Leverage Shares 2X Long XYZ Daily ETF
,BULG,Leverage Shares 2X Long BULL Daily ETF
,FSEP,FT Vest U.S. Equity Buffer ETF - September
,FDIG,Fidelity Crypto Industry and Digital Payments ETF
,PRFD,PIMCO Preferred And Capital Securities Active Exchange-Traded Fund
,EUDG,WisdomTree Europe Quality Dividend Growth Fund
,CGGG,Capital Group U.S. Large Growth ETF
,FFEB,FT Vest U.S. Equity Buffer ETF - February
,GPZ,VanEck Alternative Asset Manager ETF
,LCAP,Principal Capital Appreciation Select ETF
,RPHS,Regents Park Hedged Market Strategy ETF
,OSOL,Osprey Solana Trust
,TPYP,Tortoise North American Pipeline Fund
,DIVZ,Opal Dividend Income ETF
,COAL,Range Global Coal ETF
,EIPX,FT Energy Income Partners Strategy ETF
,METW,Roundhill ETF Trust - Roundhill META WeeklyPay ETF
,AAPW,Roundhill AAPL WeeklyPay ETF
,BGRN,iShares USD Green Bond ETF
,FINX,Global X FinTech ETF
,AUMI,Themes Gold Miners ETF
,DYLD,LeaderShares Dynamic Yield ETF
,CORX,2x Corn ETF
,FDIV,MarketDesk Focused U.S. Dividend ETF
,RFG,Invesco S&P MidCap 400 Pure Growth ETF
,FAPR,FT Vest U.S. Equity Buffer ETF - April
,KAUG,Innovator U.S. Small Cap Power Buffer ETF - August
,DBE,Invesco DB Energy Fund
,QINT,American Century Quality Diversified International ETF
,FMAT,Fidelity MSCI Materials Index ETF
,IAK,iShares U.S. Insurance ETF
,PDP,Invesco Dorsey Wright Momentum ETF
,PFM,Invesco Dividend Achievers ETF
,BCUS,Bancreek U.S. Large Cap ETF
,OUSA,ALPS O'Shares U.S. Quality Dividend ETF Shares
,LGLV,SPDR SSGA US Large Cap Low Volatility Index ETF
,LRGC,AB US Large Cap Strategic Equities ETF
,COM,Direxion Auspice Broad Commodity Strategy ETF
,FEBU,AllianzIM U.S. Equity Buffer15 Uncapped Feb ETF
,QQXT,First Trust NASDAQ-100 Ex-Technology Sector Index Fund
,FXD,First Trust Consumer Discretionary AlphaDEX Fund
,HYDR,Global X Hydrogen ETF
,ABFL,Abacus FCF Leaders ETF
,DDTL,Innovator Equity Dual Directional 10 Buffer ETF - July
,JPME,JPMorgan Diversified Return U.S. Mid Cap Equity ETF
,TOLL,Tema Durable Quality ETF
,PJP,Invesco Pharmaceuticals ETF
,UMMA,Wahed Dow Jones Islamic World ETF
,BUFT,FT Vest Buffered Allocation Defensive ETF
,GLDY,Defiance Gold Enhanced Options Income ETF
,AMDW,Roundhill ETF Trust - Roundhill AMD Weeklypay ETF
,IBHK,iShares Trust iShares iBonds 20
,CEMB,iShares J.P. Morgan EM Corporate Bond ETF
,NANC,Unusual Whales Subversive Democratic Trading ETF
,GQGU,GQG US Equity ETF
,PTL,Inspire 500 ETF
,SAUG,FT Vest U.S. Small Cap Moderate Buffer ETF - August
,CHIQ,Global X MSCI China Consumer Discretionary ETF
,GJUL,FT Vest U.S. Equity Moderate Buffer ETF - July
,IDGT,iShares U.S. Digital Infrastructure and Real Estate ETF
,RSPM,Invesco S&P 500 Equal Weight Materials ETF
,EDGU,3EDGE Dynamic US Equity ETF
,FHDG,FT Vest U.S. Equity Quarterly Dynamic Buffer ETF
,MDPL,Northern Lights Fund Trust IV - Monarch Dividend Plus Index ETF
,MFSB,MFS Active Core Plus Bond ETF
,ATMP,Barclays ETN+ Select MLP ETN
,SDOG,ALPS Sector Dividend Dogs ETF
,AALG,Leverage Shares 2X Long AAL Daily ETF
,GSPY,Gotham Enhanced 500 ETF
,GRW,TCW Compounders ETF
,DWM,WisdomTree International Equity Fund
,TAXE,T. Rowe Price Intermediate Municipal Income ETF
,REVS,Columbia Research Enhanced Value ETF
,HIGH,Simplify Enhanced Income ETF
,ADPV,Adaptiv Select ETF
,KURE,KraneShares MSCI All China Health Care Index ETF
,TYD,Direxion Daily 7-10 Year Treasury Bull 3X Shares
,LDSF,First Trust Low Duration Strategic Focus ETF
,RSSX,Return Stacked U.S. Stocks & Gold/Bitcoin ETF
,ILIT,Ishares Lithium Miners And Producers ETF
,GII,SPDR S&P Global Infrastructure ETF
,SPUU,Direxion Daily S&P 500 Bull 2X Shares
,THNQ,Robo Global Artificial Intelligence ETF
,CALI,iShares Short-Term California Muni Active ETF
,BKHY,BNY Mellon High Yield ETF
,MBS,Angel Oak Mortgage-Backed Securities ETF
,RBUF,Innovator U.S. Small Cap 10 Buffer ETF - Quarterly
,PBD,Invesco Global Clean Energy ETF
,HYGW,iShares High Yield Corporate Bond Buywrite Strategy ETF
,PNOV,Innovator U.S. Equity Power Buffer ETF - November
,BAMY,Brookstone Yield ETF
,INCO,Columbia India Consumer ETF
,VUSE,Vident U.S. Equity Strategy ETF
,GNMA,iShares GNMA Bond ETF
,XXCH,Direxion Daily MSCI Emerging Markets ex China Bull 2X Shares
,MFDX,PIMCO RAFI Dynamic Multi-Factor International Equity ETF
,SMMV,iShares MSCI USA Small-Cap Min Vol Factor ETF
,BKUI,BNY Mellon Ultra Short Income ETF
,CGVV,Capital Group U.S. Large Value ETF
,DAPR,FT Vest U.S. Equity Deep Buffer ETF - April
,ILCB,iShares Morningstar U.S. Equity ETF
,YDEC,FT Vest International Equity Moderate Buffer ETF – December
,JPMO,YieldMax JPM Option Income Strategy ETF
,IVVM,iShares Large Cap Moderate Buffer ETF
,CAFX,Congress Intermediate Bond ETF
,BSEP,Innovator U.S. Equity Buffer ETF - September
,BAMG,Brookstone Growth Stock ETF
,TSII,REX TSLA Growth & Income ETF
,XNTK,SPDR NYSE Technology ETF
,GLOW,VictoryShares WestEnd Global Equity ETF
,BAPR,Innovator U.S. Equity Buffer ETF - April
,IQM,Franklin Intelligent Machines ETF
,BUL,Pacer US Cash Cows Growth ETF
,CEPI,REX Crypto Equity Premium Income ETF
,SPBC,Simplify US Equity PLUS Bitcoin Strategy ETF
,RGLO,Russell Inv Global Equity Active ETF
,SCJ,iShares MSCI Japan Small-Cap ETF
,ONEY,SPDR Russell 1000 Yield Focus ETF
,YMAR,FT Vest International Equity Moderate Buffer ETF - March
